Symbol,Name,Last Sale,Net Change,% Change,Market Cap,Country,IPO Year,Volume,Sector,Industry
JMPNZ,JMP Group LLC 6.875% Senior Notes due 2029,$25.10 ,-0.0001,0.00%,0,United States,,1358,Finance,Investment Bankers/Brokers/Service
JNCE,Jounce Therapeutics Inc. Common Stock,$7.67 ,0.44,6.09%,392768098,United States,2017,204028,Health Care,Major Pharmaceuticals
JNJ,Johnson & Johnson Common Stock,$170.22 ,0.26,0.15%,4.48257E+11,United States,,5797650,Health Care,Major Pharmaceuticals
JNPR,Juniper Networks Inc. Common Stock,$26.58 ,0.25,0.95%,8711332390,United States,1999,3165456,Technology,Computer peripheral equipment
JOAN,JOANN Inc. Common Stock,$12.70 ,0.76,6.37%,514594780,United States,2021,233845,Consumer Non-Durables,Department/Specialty Retail Stores
JOB,GEE Group Inc. Common Stock,$0.55 ,0.0166,3.13%,62039349,United States,,3628823,Technology,Diversified Commercial Services
JOBS,51job Inc. American Depositary Shares,$71.89 ,0.38,0.53%,4847753625,China,2004,362573,Technology,Diversified Commercial Services
JOE,St. Joe Company (The) Common Stock,$44.55 ,2.52,6.00%,2623217558,United States,,202650,Consumer Services,Homebuilding
JOF,Japan Smaller Capitalization Fund Inc Common Stock,$8.95 ,0.05,0.56%,253588342,United States,1990,154984,,
JOFF,JOFF Fintech Acquisition Corp. Class A Common Stock,$9.73 ,-0.02,-0.21%,0,United States,2021,27714,,
JOFFU,JOFF Fintech Acquisition Corp. Unit,$9.98 ,0,0.00%,0,United States,2021,19154,,
JOFFW,JOFF Fintech Acquisition Corp. Warrant,$0.77 ,0.01,1.32%,0,United States,2021,737,Finance,Business Services
JOUT,Johnson Outdoors Inc. Class A Common Stock,$137.65 ,3.86,2.89%,1392768578,United States,,45646,Consumer Non-Durables,Recreational Products/Toys
JP,Jupai Holdings Limited American Depositary Shares each representing six ordinary shares,$1.97 ,0.06,3.14%,65453593,,2015,14340,Consumer Services,Other Consumer Services
JPC,Nuveen Preferred & Income Opportunities Fund,$9.56 ,0.05,0.53%,988075224,United States,2003,240184,,
JPI,Nuveen Preferred and Income Term Fund Common Shares of Beneficial Interest,$25.11 ,-0.02,-0.08%,571538528,,2012,27060,Finance,Finance Companies
JPM,JP Morgan Chase & Co. Common Stock,$164.01 ,2.51,1.55%,4.96479E+11,United States,,10581477,Finance,Major Banks
JPM^C,J P Morgan Chase & Co Depositary Shares each representing a 1/400th interest in a share of 6.00% Non-Cumulative  Preferred Stock Series EE,$27.63 ,0,0.00%,,United States,,96766,,
JPM^D,J P Morgan Chase & Co Depositary Shares each representing a 1/400th  interest in a share of 5.75% Non-Cumulative  Preferred Stock Series DD,$26.97 ,0.04,0.15%,,United States,,139238,,
JPM^G,J P Morgan Chase & Co Depositary Shares each representing a 1/400th interest in a share of 6.10% Non-Cumulative Preferred Stock Series AA,$24.99 ,-0.01,-0.04%,,United States,,400441,,
JPM^H,J P Morgan Chase & Co Depositary Shares each representing a 1/400th interest in a share of 6.15% Non-Cumulative Preferred Stock Series BB,$24.99 ,-0.01,-0.04%,,United States,,104007,,
JPM^J,J P Morgan Chase & Co Depositary Shares each representing a 1/400th interest in a share of JPMorgan Chase & Co. 4.75% Non-Cumulative Preferred Stock Series GG,$25.94 ,0.09,0.35%,,United States,,66769,,
JPM^K,J P Morgan Chase & Co Depositary Shares each representing a 1/400th interest in a share of 4.55% Non-Cumulative Preferred Stock Series JJ,$25.30 ,0.15,0.60%,,United States,,418837,,
JPS,Nuveen Preferred & Income Securities Fund,$9.70 ,0.05,0.52%,1976764426,United States,2002,350842,,
JPT,Nuveen Preferred and Income 2022 Term Fund Common Shares of Beneficial Interest,$24.52 ,-0.0328,-0.13%,167743085,United States,2017,14727,,
JQC,Nuveen Credit Strategies Income Fund Shares of Beneficial Interest,$6.56 ,0.02,0.31%,889596942,United States,2003,464310,,
JRI,Nuveen Real Asset Income and Growth Fund Common Shares of Beneficial Interest,$15.27 ,0.27,1.80%,419217694,United States,2012,89028,,
JRJC,China Finance Online Co. Limited American Depositary Shares,$9.54 ,0.44,4.84%,23296298,China,2004,40512,Finance,Investment Bankers/Brokers/Service
JRO,Nuveen Floating Rate Income Opportuntiy Fund Shares of Beneficial Interest,$9.48 ,0.02,0.21%,384330747,United States,2004,117081,,
JRS,Nuveen Real Estate Income Fund Common Shares of Beneficial Interest,$10.37 ,0.15,1.47%,299614924,United States,2001,99274,,
JRSH,Jerash Holdings (US) Inc. Common Stock,$6.49 ,-0.11,-1.67%,73499250,United States,2018,24818,Basic Industries,Industrial Specialties
JRVR,James River Group Holdings Ltd. Common Shares,$34.31 ,1.49,4.54%,1278817073,Bermuda,2014,445128,Finance,Property-Casualty Insurers
JSD,Nuveen Short Duration Credit Opportunities Fund Common Shares of Beneficial Interest,$14.40 ,0.04,0.28%,145233331,United States,2011,13306,Finance,Finance Companies
JSM,Navient Corporation 6% Senior Notes due December 15 2043,$24.23 ,0.14,0.58%,0,United States,,24614,Finance,Finance: Consumer Services
JT,Jianpu Technology Inc. American depositary shares,$2.72 ,0.14,5.43%,57613337,,2017,118793,Technology,EDP Services
JTA,Nuveen Tax-Advantaged Total Return Strategy Fund Common Share of Beneficial Interest,$11.32 ,0.11,0.98%,156792154,United States,2004,34383,,
JTD,Nuveen Tax-Advantaged Dividend Growth Fund Common Shares of Beneficial Interest,$15.85 ,0.23,1.47%,229576789,United States,,39373,,
JUPW,Jupiter Wellness Inc. Common Stock,$4.03 ,-0.1,-2.42%,45378558,United States,2020,133812,Health Care,Major Pharmaceuticals
JUPWW,Jupiter Wellness Inc. Warrant,$1.89 ,0.04,2.16%,0,United States,2020,1404,Health Care,Major Pharmaceuticals
JVA,Coffee Holding Co. Inc. Common Stock,$5.17 ,0.1,1.97%,29513457,United States,2005,28540,Consumer Non-Durables,Specialty Foods
JW/A,John Wiley & Sons Inc.,$61.72 ,0.46,0.75%,,United States,,243168,,
JW/B,John Wiley & Sons Inc.,$60.27 ,0,0.00%,,United States,,5,,
JWEL,Jowell Global Ltd. Ordinary Shares,$7.66 ,0.005,0.07%,194596637,China,2021,21125,Consumer Services,Other Consumer Services
JWN,Nordstrom Inc. Common Stock,$40.95 ,4.14,11.25%,6460697061,United States,,4215022,Consumer Services,Clothing/Shoe/Accessory Stores
JWS,Jaws Acquisition Corp. Class A Ordinary Shares,$13.25 ,0.23,1.77%,1142812500,,2020,679876,Finance,Business Services
JWSM,Jaws Mustang Acquisition Corp. Class A Ordinary Shares,$9.80 ,-0.01,-0.10%,1267875000,,2021,253326,Finance,Business Services
JYAC,Jiya Acquisition Corp. Class A Common Stock,$9.81 ,-0.11,-1.11%,131915963,United States,2020,497,,
JYNT,The Joint Corp. Common Stock,$50.41 ,1.52,3.11%,717167947,United States,2014,92249,,
K,Kellogg Company Common Stock,$66.54 ,-1.15,-1.70%,22656626197,United States,,2985139,Consumer Non-Durables,Packaged Foods
KAHC,KKR Acquisition Holdings I Corp. Class A Common Stock,$9.76 ,0,0.00%,1683600000,,2021,50574,,
KAI,Kadant Inc Common Stock,$175.73 ,1.86,1.07%,2034563279,United States,,18899,Technology,Industrial Machinery/Components
KAII,Kismet Acquisition Two Corp. Class A Ordinary Shares,$9.72 ,-0.012,-0.12%,284251500,United States,2021,2696,Finance,Business Services
KAIIU,Kismet Acquisition Two Corp. Unit,$9.88 ,-0.05,-0.50%,0,United States,2021,5288,Finance,Business Services
KAIIW,Kismet Acquisition Two Corp. Warrant,$0.55 ,-0.0265,-4.60%,0,United States,2021,45253,Finance,Business Services
KAIR,Kairos Acquisition Corp. Class A Ordinary Shares,$9.73 ,-0.03,-0.31%,268548000,United States,2021,2461,Finance,Business Services
KAIRU,Kairos Acquisition Corp. Unit,$10.03 ,-0.04,-0.40%,0,United States,2021,926,Finance,Business Services
KAIRW,Kairos Acquisition Corp. Warrant,$0.71 ,0,0.00%,0,United States,2021,895,Finance,Business Services
KALA,Kala Pharmaceuticals Inc. Common Stock,$5.06 ,-0.03,-0.59%,283662917,United States,2017,3076085,Health Care,Major Pharmaceuticals
KALU,Kaiser Aluminum Corporation Common Stock,$132.56 ,2.38,1.83%,2100802661,United States,,86134,Basic Industries,Aluminum
KALV,KalVista Pharmaceuticals Inc. Common Stock,$26.06 ,0.95,3.78%,633471457,United Kingdom,2015,150508,Health Care,Major Pharmaceuticals
KAMN,Kaman Corporation Common Stock,$54.30 ,1.04,1.95%,1510086041,United States,,82050,Capital Goods,Military/Government/Technical
KAR,KAR Auction Services Inc Common Stock,$18.50 ,0.51,2.84%,2308080350,United States,2009,2304030,,
KARO,Karooooo Ltd. Ordinary Shares,$36.67 ,0.95,2.66%,789886248,Singapore,2021,17069,Technology,Computer Software: Prepackaged Software
KB,KB Financial Group Inc,$51.58 ,-1.14,-2.16%,20097338999,South Korea,,244851,Finance,Commercial Banks
KBAL,Kimball International Inc. Class B Common Stock,$13.12 ,0.16,1.24%,482616077,United States,,190949,Consumer Durables,Industrial Specialties
KBH,KB Home Common Stock,$46.96 ,1.02,2.22%,4636721922,United States,1986,1141485,,
KBNT,Kubient Inc. Common Stock,$4.73 ,0.68,16.79%,65621702,United States,2020,562220,Technology,EDP Services
KBNTW,Kubient Inc. Warrant,$1.84 ,0.05,2.79%,0,United States,2020,25221,Technology,EDP Services
KBR,KBR Inc. Common Stock,$42.34 ,0.68,1.63%,5984598066,United States,2006,1465439,Capital Goods,Oilfield Services/Equipment
KBSF,KBS Fashion Group Limited Common Stock,$3.00 ,0.18,6.38%,7773897,China,2013,336979,Consumer Non-Durables,Apparel
KC,Kingsoft Cloud Holdings Limited American Depositary Shares,$37.65 ,2.11,5.94%,8408159406,China,2020,1514797,Technology,Computer Software: Prepackaged Software
KCAC,Kensington Capital Acquisition Corp. II Class A Common Stock,$10.00 ,-0.05,-0.50%,0,,2021,8387,,
KCAPL,KCAP Financial Inc. 6.125% Notes due 2022,$25.22 ,0,0.00%,0,United States,,7450,,
KDMN,Kadmon Holdings Inc. Common Stock,$3.73 ,0.16,4.49%,640602643,United States,,1653162,Health Care,Major Pharmaceuticals
KDNY,Chinook Therapeutics Inc. Common Stock,$14.85 ,-0.14,-0.93%,662551996,United States,2015,124043,Health Care,Major Pharmaceuticals
KDP,Keurig Dr Pepper Inc. Common Stock,$36.05 ,0.33,0.92%,51096899478,United States,,2992698,Consumer Non-Durables,Beverages (Production/Distribution)
KE,Kimball Electronics Inc. Common Stock,$22.18 ,0.31,1.42%,553547613,United States,,47895,Capital Goods,Industrial Machinery/Components
KELYA,Kelly Services Inc. Class A Common Stock,$25.63 ,0.54,2.15%,1006941214,United States,,116226,Technology,Diversified Commercial Services
KELYB,Kelly Services Inc. Class B Common Stock,$25.19 ,0.17,0.68%,989654669,United States,,1452,Technology,Diversified Commercial Services
KEN,Kenon Holdings Ltd. Ordinary Shares,$33.11 ,0.597,1.84%,1783668168,Singapore,2015,5788,Public Utilities,Electric Utilities: Central
KEP,Korea Electric Power Corporation Common Stock,$10.60 ,0,0.00%,13609638432,South Korea,1994,358802,Consumer Durables,Electrical Products
KEQU,Kewaunee Scientific Corporation Common Stock,$11.90 ,0,0.00%,32877284,United States,,39,Capital Goods,Medical Specialities
KERN,Akerna Corp. Common Stock,$3.44 ,0.06,1.78%,48361952,United States,2018,536382,Health Care,Managed Health Care
KERNW,Akerna Corp Warrant,$0.78 ,0.05,6.85%,0,United States,2018,2275,,
KEX,Kirby Corporation Common Stock,$69.54 ,1.3,1.91%,4179701700,United States,,380183,Transportation,Marine Transportation
KEY,KeyCorp Common Stock,$23.39 ,0.4,1.74%,22700449655,United States,,7187856,Finance,Major Banks
KEY^I,KeyCorp Depositary Shares Each Representing a 1/40th Ownership Interest in a Share of Fixed-to-Floating Rate Perpetual Non-Cumulative Preferred Stock Series E,$30.01 ,0.29,0.98%,,United States,,21269,,
KEY^J,KeyCorp Depositary Shares each representing a 1/40th ownership interest in a share of Fixed Rate Perpetual Non-Cumulative Preferred Stock Series F,$26.67 ,-0.01,-0.04%,,United States,,21730,,
KEY^K,KeyCorp Depositary Shares each representing a 1/40th ownership interest in a share of Fixed Rate Perpetual Non-Cumulative Preferred Stock Series G,$27.13 ,0.23,0.86%,,United States,,11308,,
KEYS,Keysight Technologies Inc. Common Stock,$139.85 ,1.8,1.30%,26011321315,United States,2014,814598,Capital Goods,Industrial Machinery/Components
KF,Korea Fund Inc. (The) New Common Stock,$43.80 ,0.59,1.37%,219874949,United States,,11186,,
KFFB,Kentucky First Federal Bancorp Common Stock,$7.10 ,0.1,1.43%,58409677,United States,,1256,Finance,Savings Institutions
KFRC,Kforce Inc. Common Stock,$60.32 ,0.81,1.36%,1321908940,United States,1995,68506,Technology,Diversified Commercial Services
KFS,Kingsway Financial Services Inc. Common Stock (DE),$4.94 ,0,0.00%,117105817,Canada,,17986,,
KFY,Korn Ferry Common Stock,$67.18 ,1.18,1.79%,3628174741,United States,1999,148420,Technology,Diversified Commercial Services
KGC,Kinross Gold Corporation Common Stock,$7.78 ,0.28,3.73%,9812136000,Canada,,13801956,,
KHC,The Kraft Heinz Company Common Stock,$43.73 ,-0.09,-0.21%,53488233178,United States,,3295145,Consumer Non-Durables,Farming/Seeds/Milling
KIDS,OrthoPediatrics Corp. Common Stock,$56.00 ,-0.02,-0.04%,1100927072,United States,2017,79659,Health Care,Medical/Dental Instruments
KIII,Kismet Acquisition Three Corp. Class A Ordinary Shares,$9.70 ,0,0.00%,353443750,United States,2021,47332,Finance,Business Services
KIIIU,Kismet Acquisition Three Corp. Unit,$9.93 ,0.055,0.56%,0,United States,2021,182896,Finance,Business Services
KIIIW,Kismet Acquisition Three Corp. Warrant,$0.70 ,0.2,40.00%,0,United States,2021,3482,Finance,Business Services
KIM,Kimco Realty Corporation Common Stock,$21.23 ,0.37,1.77%,9202338858,United States,,3170221,Consumer Services,Real Estate Investment Trusts
KIM^L,Kimco Realty Corporation Class L Depositary Shares each of which represents a one-one thousandth fractional interest in a share of 5.125% Class L Cumulative Redeemable Preferred Stock liquidation preference $25000.00 per share,$26.25 ,0.23,0.88%,,United States,,4265,,
KIM^M,Kimco Realty Corporation Class M Depositary Shares each of which represents a one-one thousandth fractional interest in a share of 5.25% Class M Cumulative Redeemable Preferred Stock liquidation preference $25000.00 per share,$26.65 ,0.18,0.68%,,United States,,13674,,
KIN,Kindred Biosciences Inc. Common Stock,$4.35 ,0.13,3.08%,196939742,United States,2013,121542,Health Care,Major Pharmaceuticals
KINS,Kingstone Companies Inc. Common Stock,$8.12 ,0.0413,0.51%,86909337,United States,,9707,Finance,Specialty Insurers
KINZ,KINS Technology Group Inc. Class A Common Stock,$9.87 ,0,0.00%,340515000,United States,2021,835,,
KINZU,KINS Technology Group Inc. Unit,$10.15 ,-0.01,-0.10%,0,United States,2020,3072,,
KINZW,KINS Technology Group Inc. Warrant,$0.66 ,0.0299,4.75%,0,United States,2021,77484,Finance,Business Services
KIO,KKR Income Opportunities Fund Common Shares,$15.86 ,0.1,0.64%,322597396,,2013,62462,,
KIQ,Kelso Technologies Inc Ordinary Shares,$0.64 ,0.0325,5.35%,34738282,Canada,,533195,,
KIRK,Kirkland's Inc. COMMONSTOCK,$27.96 ,0.84,3.10%,399504139,United States,2002,327503,Miscellaneous,Diversified Commercial Services
KJUL,Innovator Russell 2000 Power Buffer ETF - July,$26.48 ,0.0102,0.04%,,,2020,2914,,
KKR,KKR & Co. Inc. Common Stock,$56.14 ,1.02,1.85%,32661058744,United States,,2314866,Finance,Investment Managers
KKR^A,KKR & Co. Inc. 6.75% Series A Preferred Stock,$25.38 ,-0.03,-0.12%,,United States,,28228,,
KKR^B,KKR & Co. Inc. 6.50% Series B Preferred Stock,$25.69 ,-0.01,-0.04%,,United States,,3772,,
KKR^C,KKR & Co. Inc. 6.00% Series C Mandatory Convertible Preferred Stock,$74.97 ,0.538,0.72%,,United States,,33567,,
KKRS,KKR Group Finance Co. IX LLC 4.625% Subordinated Notes due 2061,$25.58 ,0.02,0.08%,0,,2021,55023,,
KL,Kirkland Lake Gold Ltd. Common Shares,$41.47 ,0.87,2.14%,11075885356,,,1661891,,
KLAC,KLA Corporation Common Stock,$305.75 ,9.89,3.34%,46865905152,United States,1980,1508053,Capital Goods,Electronic Components
KLAQ,KL Acquisition Corp Class A Common Stock,$9.79 ,0,0.00%,351828125,United States,2021,5614,,
KLAQU,KL Acquisition Corp Unit,$10.02 ,0.02,0.20%,0,United States,2021,159,,
KLAQW,KL Acquisition Corp Warrant,$0.67 ,-0.014,-2.05%,0,United States,2021,4049,Finance,Business Services
KLDO,Kaleido Biosciences Inc. Common Stock,$6.32 ,0.495,8.51%,268505294,United States,2019,259786,Health Care,Biotechnology: Biological Products (No Diagnostic Substances)
KLIC,Kulicke and Soffa Industries Inc. Common Stock,$46.82 ,2.59,5.86%,2905346462,Singapore,,862062,Technology,Semiconductors
KLR,Kaleyra Inc. Common Stock,$12.21 ,-0.03,-0.25%,382262573,United States,2018,219640,Technology,Internet and Information Services
KLXE,KLX Energy Services Holdings Inc. Common Stock,$12.14 ,0.19,1.59%,107255516,United States,,123234,Energy,Oilfield Services/Equipment
KMB,Kimberly-Clark Corporation Common Stock,$134.18 ,0.43,0.32%,45276570478,United States,,2139254,Basic Industries,Paper
KMDA,Kamada Ltd. Ordinary Shares,$5.73 ,0.06,1.06%,256390936,Israel,2013,57194,Health Care,Major Pharmaceuticals
KMF,Kayne Anderson NextGen Energy & Infrastructure Inc.,$7.12 ,0.11,1.57%,336045929,,2010,83774,,
KMI,Kinder Morgan Inc. Common Stock,$18.36 ,0.34,1.89%,41577736224,United States,2011,12253934,Public Utilities,Natural Gas Distribution
KMPH,KemPharm Inc. Common Stock,$9.11 ,0.59,6.93%,259537523,United States,,896580,Health Care,Major Pharmaceuticals
KMPR,Kemper Corporation,$77.80 ,0.03,0.04%,5023274167,United States,,278061,Finance,Property-Casualty Insurers
KMT,Kennametal Inc. Common Stock,$41.83 ,0.62,1.50%,3496931488,United States,,256614,Capital Goods,Industrial Machinery/Components
KMX,CarMax Inc,$124.83 ,3.72,3.07%,20366156307,United States,,897750,Consumer Services,Other Specialty Stores
KN,Knowles Corporation Common Stock,$19.78 ,0.27,1.38%,1835454441,,2014,1427197,Consumer Non-Durables,Consumer Electronics/Appliances
KNBE,KnowBe4 Inc. Class A Common Stock,$18.69 ,1.14,6.50%,3103930573,United States,2021,210475,Technology,Computer Software: Prepackaged Software
KNDI,Kandi Technologies Group Inc Common Stock,$4.92 ,0.39,8.61%,370906771,China,,1579166,Capital Goods,Auto Parts:O.E.M.
KNGS,UPHOLDINGS Compound Kings ETF,$26.90 ,0.4723,1.79%,,United States,2020,10774,,
KNL,Knoll Inc. Common Stock,$25.22 ,0.58,2.35%,1281495790,United States,2004,530628,,
KNOP,KNOT Offshore Partners LP Common Units representing Limited Partner Interests,$18.84 ,0.05,0.27%,615956731,United Kingdom,2013,167381,Transportation,Marine Transportation
KNSA,Kiniksa Pharmaceuticals Ltd. Class A Common Stock,$14.13 ,0.3,2.17%,965531640,United States,2018,474792,Health Care,Major Pharmaceuticals
KNSL,Kinsale Capital Group Inc. Common Stock,$161.53 ,4.9,3.13%,3684857250,United States,2016,114119,Finance,Property-Casualty Insurers
KNTE,Kinnate Biopharma Inc. Common Stock,$22.74 ,0.55,2.48%,988889195,United States,2020,140022,Health Care,Major Pharmaceuticals
KNX,Knight-Swift Transportation Holdings Inc.,$48.88 ,-0.07,-0.14%,8090160963,United States,2017,857163,Transportation,Trucking Freight/Courier Services
KO,Coca-Cola Company (The) Common Stock,$54.73 ,0.22,0.40%,2.35948E+11,United States,,11725316,Consumer Non-Durables,Beverages (Production/Distribution)
KOD,Kodiak Sciences Inc Common Stock,$84.05 ,3.73,4.64%,4308822494,United States,2018,326421,Health Care,Major Pharmaceuticals
KODK,Eastman Kodak Company Common New,$6.75 ,0.31,4.81%,529898463,United States,,2247932,Miscellaneous,Business Services
KOF,Coca Cola Femsa S.A.B. de C.V.  American Depositary Shares each representing 10 Units (each Unit consists of 3 Series B Shares and 5 Series L Shares),$48.97 ,0.89,1.85%,10287775577,Mexico,1993,157866,Consumer Non-Durables,Beverages (Production/Distribution)
KOP,Koppers Holdings Inc. Koppers Holdings Inc. Common Stock,$35.16 ,1.18,3.47%,746828673,United States,2006,121529,Basic Industries,Industrial Specialties
KOPN,Kopin Corporation Common Stock,$6.53 ,0.39,6.35%,596090221,United States,1992,2598363,Capital Goods,Industrial Machinery/Components
KOR,Corvus Gold Inc. Common Shares,$2.73 ,0.07,2.63%,346196678,Canada,,99824,,
KOS,Kosmos Energy Ltd. Common Shares (DE),$2.94 ,0.23,8.49%,1199662046,Bermuda,2011,5156307,Energy,Oil & Gas Production
KOSS,Koss Corporation Common Stock,$18.55 ,0.3,1.64%,157987067,United States,,1367960,Consumer Non-Durables,Consumer Electronics/Appliances
KPTI,Karyopharm Therapeutics Inc. Common Stock,$9.18 ,-0.13,-1.40%,689349765,United States,2013,1848765,Miscellaneous,Diversified Commercial Services
KR,Kroger Company (The) Common Stock,$37.20 ,0.39,1.06%,27974165677,United States,,6692151,Consumer Services,Food Chains
KRA,Kraton Corporation Common Stock,$35.17 ,0.39,1.12%,1130506133,United States,2009,176951,Basic Industries,Major Chemicals
KRBP,Kiromic BioPharma Inc. Common Stock,$5.79 ,0.49,9.25%,42458064,United States,2020,16335,Consumer Durables,Specialty Chemicals
KRC,Kilroy Realty Corporation Common Stock,$66.75 ,0.51,0.77%,7773062198,United States,1997,336805,Consumer Services,Real Estate Investment Trusts
KREF,KKR Real Estate Finance Trust Inc. Common Stock,$20.30 ,0.44,2.22%,1129440844,United States,2017,723583,Consumer Services,Real Estate Investment Trusts
KREF^A,KKR Real Estate Finance Trust Inc. 6.50% Series A Cumulative Redeemable Preferred Stock,$25.61 ,0.11,0.43%,,United States,,79010,,
KRG,Kite Realty Group Trust Common Stock,$20.56 ,0.51,2.54%,1737021469,United States,2004,555154,Consumer Services,Real Estate Investment Trusts
KRKR,36Kr Holdings Inc. American Depositary Shares,$2.36 ,0.03,1.29%,90989311,China,2019,44334,Miscellaneous,Business Services
KRMD,Repro Med Systems Inc. Common Stock,$4.10 ,-0.07,-1.68%,182349792,United States,,481646,Health Care,Medical/Dental Instruments
KRNL,Kernel Group Holdings Inc. Class A Ordinary Shares,$9.70 ,-0.01,-0.10%,0,United States,2021,2529,Finance,Business Services
KRNLU,Kernel Group Holdings Inc. Units,$10.00 ,0,0.00%,0,United States,2021,945,Finance,Business Services
KRNLW,Kernel Group Holdings Inc. Warrants,$0.58 ,0.0402,7.44%,0,United States,2021,35111,Finance,Business Services
KRNT,Kornit Digital Ltd. Ordinary Shares,$90.68 ,4.94,5.76%,4179321049,Israel,2015,415518,Capital Goods,Industrial Machinery/Components
KRNY,Kearny Financial Corp Common Stock,$13.24 ,0.18,1.38%,1069698963,United States,,224369,Finance,Savings Institutions
KRO,Kronos Worldwide Inc Common Stock,$17.21 ,0.1,0.58%,1988490160,United States,,86462,Basic Industries,Major Chemicals
KRON,Kronos Bio Inc. Common Stock,$24.80 ,-0.57,-2.25%,1390532379,United States,2020,214657,Consumer Durables,Specialty Chemicals
KROS,Keros Therapeutics Inc. Common Stock,$48.87 ,2.55,5.51%,1138520969,United States,2020,161616,Consumer Durables,Specialty Chemicals
KRP,Kimbell Royalty Partners Common Units Representing Limited Partner Interests,$12.91 ,-0.15,-1.15%,775660660,United States,2017,120672,Energy,Oil & Gas Production
KRT,Karat Packaging Inc. Common Stock,$17.20 ,0.99,6.11%,339003400,United States,2021,30298,Capital Goods,Office Equipment/Supplies/Services
KRTX,Karuna Therapeutics Inc. Common Stock,$113.83 ,-1.9,-1.64%,3353192302,United States,2019,150112,Health Care,Major Pharmaceuticals
KRUS,Kura Sushi USA Inc. Class A Common Stock,$34.11 ,-0.32,-0.93%,287144870,United States,2019,45598,Consumer Services,Restaurants
KRYS,Krystal Biotech Inc. Common Stock,$67.93 ,5.39,8.62%,1508360312,United States,2017,148971,Health Care,Biotechnology: Biological Products (No Diagnostic Substances)
KSICU,Kadem Sustainable Impact Corporation Unit,$9.96 ,-0.0194,-0.19%,0,United States,2021,118,,
KSM,DWS Strategic Municipal Income Trust,$11.96 ,-0.05,-0.42%,133999134,United States,1989,13746,,
KSMT,Kismet Acquisition One Corp Ordinary Shares,$9.85 ,0,0.00%,312737500,Russia,2020,5984,Finance,Business Services
KSMTU,Kismet Acquisition One Corp Unit,$9.50 ,-0.5021,-5.02%,0,Russia,2020,520,Finance,Business Services
KSMTW,Kismet Acquisition One Corp Warrant,$0.68 ,0,0.00%,0,Russia,,3300,Finance,Business Services
KSPN,Kaspien Holdings Inc. Common Stock,$19.89 ,2.19,12.37%,49302377,United States,,9655,Consumer Services,Consumer Electronics/Video Chains
KSS,Kohl's Corporation Common Stock,$61.32 ,4.54,8.00%,9663580501,United States,1992,4083153,Consumer Services,Department/Specialty Retail Stores
KSU,Kansas City Southern Common Stock,$309.01 ,-4.44,-1.42%,28099435306,United States,,3057229,Transportation,Railroads
KSU^,Kansas City Southern Preferred Stock,$37.02 ,-0.23,-0.62%,,United States,,636,,
KT,KT Corporation Common Stock,$13.72 ,-0.12,-0.87%,6525192047,South Korea,,541271,Public Utilities,Telecommunications Equipment
KTB,Kontoor Brands Inc. Common Stock ,$65.43 ,4.08,6.65%,3753852970,,2019,364705,,
KTCC,Key Tronic Corporation Common Stock,$6.78 ,0.06,0.89%,72950630,United States,1983,19103,Technology,Computer peripheral equipment
KTF,DWS Municipal Income Trust,$11.79 ,0.02,0.17%,465716059,United States,1988,63036,,
KTH,Structures Products Cp 8% CorTS Issued by Peco Energy Cap Tr II Preferred Stock,$33.56 ,0.37,1.12%,0,United States,,520,Finance,Investment Managers
KTN,Structured Products Corp 8.205% CorTS 8.205% Corporate Backed Trust Securities (CorTS),$33.25 ,0.29,0.88%,0,United States,,6588,,
KTOS,Kratos Defense & Security Solutions Inc. Common Stock,$25.00 ,0.47,1.92%,3094748925,United States,,959936,Consumer Non-Durables,Ordnance And Accessories
KTRA,Kintara Therapeutics Inc. Common Stock,$1.28 ,-0.02,-1.54%,41445453,United States,,139183,Health Care,Major Pharmaceuticals
KUKE,Kuke Music Holding Limited American Depositary Shares each representing one Ordinary Share,$4.65 ,-0.15,-3.13%,137485262,,2021,59688,Consumer Services,Other Consumer Services
KURA,Kura Oncology Inc. Common Stock,$25.11 ,0.11,0.44%,1664132105,United States,,435156,Health Care,Biotechnology: Biological Products (No Diagnostic Substances)
KURI,Alkuri Global Acquisition Corp. Class A common stock,$9.72 ,0.01,0.10%,419175000,United States,2021,9536,,
KURIU,Alkuri Global Acquisition Corp. Unit,$9.93 ,0.035,0.35%,0,United States,2021,8054,,
KURIW,Alkuri Global Acquisition Corp. Warrant,$0.85 ,-0.0229,-2.62%,0,United States,2021,682,Finance,Business Services
KVHI,KVH Industries Inc. Common Stock,$14.49 ,0.43,3.06%,271842340,United States,1996,97879,Technology,Radio And Television Broadcasting And Communications Equipment
