Symbol,Name,Last Sale,Net Change,% Change,Market Cap,Country,IPO Year,Volume,Sector,Industry
DJCO,Daily Journal Corp. (S.C.) Common Stock,$306.00 ,5.5,1.83%,422508276,United States,,9041,Consumer Services,Newspapers/Magazines
DJUL,FT Cboe Vest U.S. Equity Deep Buffer ETF - July,$32.48 ,0.0451,0.14%,,United States,2020,268,,
DJUN,FT Cboe Vest U.S. Equity Deep Buffer ETF - June,$33.09 ,0.0259,0.08%,,United States,2020,34,,
DK,Delek US Holdings Inc. Common Stock,$22.09 ,0.96,4.54%,1631914743,United States,2017,1034104,Energy,Integrated oil Companies
DKDCU,Data Knights Acquisition Corp. Unit,$10.10 ,0.01,0.10%,0,United Kingdom,2021,48588,Finance,Business Services
DKL,Delek Logistics Partners L.P. Common Units representing Limited Partner Interests,$41.13 ,0.83,2.06%,1786824410,United States,2012,40065,Energy,Oil & Gas Production
DKNG,DraftKings Inc. Class A Common Stock,$44.89 ,3.9,9.52%,18000032017,United States,2019,28397293,Consumer Services,Services-Misc. Amusement & Recreation
DKS,Dick's Sporting Goods Inc Common Stock,$87.96 ,2.92,3.43%,7853106183,United States,2002,1002903,Consumer Services,Other Specialty Stores
DLA,Delta Apparel Inc. Common Stock,$33.12 ,0.91,2.83%,231000739,United States,,17864,Consumer Non-Durables,Department/Specialty Retail Stores
DLB,Dolby Laboratories Common Stock,$95.43 ,2.03,2.17%,9672865916,United States,2005,409593,Technology,EDP Services
DLCA,Deep Lake Capital Acquisition Corp. Class A Ordinary Shares,$9.71 ,-0.05,-0.51%,251246250,United States,2021,91994,Finance,Business Services
DLCAU,Deep Lake Capital Acquisition Corp. Unit,$9.99 ,-0.01,-0.10%,0,United States,2021,2386,Finance,Business Services
DLCAW,Deep Lake Capital Acquisition Corp. Warrant,$0.75 ,0,0.00%,0,United States,2021,17106,Finance,Business Services
DLHC,DLH Holdings Corp.,$10.33 ,0.12,1.18%,129588879,United States,,17865,Miscellaneous,Business Services
DLNG,Dynagas LNG Partners LP Common Units,$2.72 ,0.07,2.64%,100084595,Greece,,60217,,
DLNG^A,Dynagas LNG Partners LP 9.00% Series A Cumulative Redeemable Preferred Units,$25.46 ,0.0635,0.25%,,Greece,,5586,,
DLNG^B,Dynagas LNG Partners LP 8.75% Series B Fixed to Floating Rate Cumulative Redeemable Perpetual Preferred Units liquidation preference $25.00 per Uni,$24.09 ,-0.28,-1.15%,,Greece,,12549,,
DLPN,Dolphin Entertainment Inc. Common Stock,$9.06 ,0.65,7.73%,68751275,United States,,407263,,
DLR,Digital Realty Trust Inc. Common Stock,$148.88 ,-0.06,-0.04%,41922775585,United States,2004,555731,Consumer Services,Real Estate Investment Trusts
DLR^C,Digital Realty Trust Inc. 6.625% Series C Cumulative Redeemable Perpetual Preferred Stock,$25.21 ,-0.0007,0.00%,,United States,,11267,,
DLR^J,Digital Realty Trust Inc. 5.250% Series J Cumulative Redeemable Preferred Stock,$26.50 ,0.08,0.30%,,United States,,3784,,
DLR^K,Digital Realty Trust Inc. 5.850% Series K Cumulative Redeemable Preferred Stock par value $0.01 per share,$27.96 ,0.08,0.29%,,United States,,38768,,
DLR^L,Digital Realty Trust Inc. 5.200% Series L Cumulative Redeemable Preferred Stock,$27.19 ,0.07,0.26%,,United States,,15694,,
DLTH,Duluth Holdings Inc. Class B Common Stock,$16.63 ,0.98,6.26%,547330069,United States,2015,110966,Consumer Services,Department/Specialty Retail Stores
DLTR,Dollar Tree Inc. Common Stock,$111.23 ,1.65,1.51%,26028888920,United States,1995,1089944,Consumer Services,Department/Specialty Retail Stores
DLX,Deluxe Corporation Common Stock,$45.96 ,0.49,1.08%,1939584387,United States,,147175,Technology,Advertising
DLY,DoubleLine Yield Opportunities Fund Common Shares of Beneficial Interest,$19.77 ,0.1075,0.55%,0,,2020,42557,,
DM,Desktop Metal Inc. Class A Common Stock,$12.59 ,0.89,7.61%,3077609737,,2019,2715782,Technology,Computer peripheral equipment
DMAC,DiaMedica Therapeutics Inc. Common Stock,$6.50 ,0.03,0.46%,121803981,United States,2018,112094,,
DMAR,FT Cboe Vest U.S. Equity Deep Buffer ETF - March,$30.61 ,0.187,0.62%,,United States,2021,13105,,
DMAY,FT Cboe Vest U.S. Equity Deep Buffer ETF - May,$33.15 ,0.0098,0.03%,,United States,2020,4170,,
DMB,BNY Mellon Municipal Bond Infrastructure Fund Inc. Common Stock,$14.81 ,0.08,0.54%,272344689,,2013,24603,,
DMF,BNY Mellon Municipal Income Inc. Common Stock,$8.96 ,0,0.00%,185927150,United States,1988,17877,,
DMLP,Dorchester Minerals L.P. Common Units Representing Limited Partnership Interests,$15.01 ,0.33,2.25%,520543408,United States,,47341,Energy,Oil & Gas Production
DMO,Western Asset Mortgage Opportunity Fund Inc. Common Stock,$14.97 ,0.12,0.81%,165075897,United States,2010,26651,,
DMRC,Digimarc Corporation Common Stock,$30.40 ,1.84,6.44%,514210862,United States,,168768,Technology,EDP Services
DMS,Digital Media Solutions Inc. Class A Ordinary Shares,$10.45 ,0.37,3.67%,640388153,United States,2018,31765,Technology,Advertising
DMTK,DermTech Inc. Common Stock,$33.59 ,4.45,15.27%,971397675,United States,2017,1448864,Health Care,Managed Health Care
DMYI,dMY Technology Group Inc. III Class A Common Stock,$10.05 ,-0.03,-0.30%,376875000,United States,2021,160024,,
DMYQ,dMY Technology Group Inc. IV Class A Common Stock,$9.84 ,0,0.00%,424350000,,2021,45884,,
DNB,Dun & Bradstreet Holdings Inc. Common Stock,$22.14 ,0.32,1.47%,9551401946,United States,2020,1644855,Technology,EDP Services
DNLI,Denali Therapeutics Inc. Common Stock,$53.90 ,2.2,4.26%,6532260119,United States,2017,322054,Health Care,Biotechnology: Biological Products (No Diagnostic Substances)
DNMR,Danimer Scientific Inc. Common Stock,$17.72 ,1.52,9.38%,1565167181,,2020,2346231,Consumer Non-Durables,Plastic Products
DNN,Denison Mines Corp Ordinary Shares (Canada),$1.14 ,0.1,9.62%,917592191,Canada,,8538581,,
DNOV,FT Cboe Vest U.S. Equity Deep Buffer ETF - November,$34.41 ,0.1574,0.46%,,United States,2019,25331,,
DNOW,NOW Inc. Common Stock,$11.30 ,0.41,3.77%,1245881534,,2014,731147,Energy,Metal Fabrications
DNP,DNP Select Income Fund Inc. Common Stock,$10.29 ,0.07,0.69%,3182723229,United States,1987,637521,,
DNZ,D and Z Media Acquisition Corp. Class A Common Stock,$9.80 ,0.0645,0.66%,352187500,,2021,2023,,
DOC,Physicians Realty Trust Common Shares of Beneficial Interest,$18.09 ,-0.05,-0.28%,3897841717,United States,2013,1212796,Consumer Services,Real Estate Investment Trusts
DOCN,DigitalOcean Holdings Inc. Common Stock,$37.23 ,1.8,5.08%,3967357802,,2021,195174,Technology,Retail: Computer Software & Peripheral Equipment
DOCT,FT Cboe Vest U.S. Equity Deep Buffer ETF - October,$31.89 ,0.1311,0.41%,,United States,2020,4956,,
DOCU,DocuSign Inc. Common Stock,$187.08 ,6.92,3.84%,36397558181,United States,2018,2036970,Technology,EDP Services
DOGZ,Dogness (International) Corporation Class A Common Stock,$1.67 ,0.05,3.09%,49055939,China,2017,87513,Consumer Durables,Miscellaneous manufacturing industries
DOMO,Domo Inc. Class B Common Stock,$58.93 ,3.78,6.85%,1866243327,United States,2018,156066,Technology,Computer Software: Prepackaged Software
DOOO,BRP Inc. (Recreational Products) Common Subordinate Voting Shares,$82.54 ,-0.01,-0.01%,6925245245,Canada,,101597,,
DOOR,Masonite International Corporation Ordinary Shares (Canada),$124.01 ,2.51,2.07%,3038344952,Canada,,56788,,
DORM,Dorman Products Inc. Common Stock,$103.85 ,0.82,0.80%,3331775829,United States,,74554,Capital Goods,Auto Parts:O.E.M.
DOV,Dover Corporation Common Stock,$151.40 ,1.83,1.22%,21790588981,United States,,625882,Capital Goods,Industrial Machinery/Components
DOW,Dow Inc. Common Stock ,$69.83 ,1.75,2.57%,52162272735,,2019,4816473,Basic Industries,Industrial Specialties
DOX,Amdocs Limited Ordinary Shares,$77.90 ,2.28,3.02%,10191267500,Guernsey,,733529,Technology,EDP Services
DOYU,DouYu International Holdings Limited ADS,$7.84 ,0.37,4.95%,2543372754,China,2019,1875003,Technology,Computer Software: Programming Data Processing
DPG,Duff & Phelps Utility and Infrastructure Fund Inc.,$14.35 ,-0.04,-0.28%,544292716,United States,2011,166954,,
DPW,Ault Global Holdings Inc. Common Stock,$2.36 ,0.01,0.43%,116816875,United States,,2387107,Capital Goods,Industrial Machinery/Components
DPZ,Domino's Pizza Inc Common Stock,$427.29 ,4.89,1.16%,16590984045,United States,2004,636235,Consumer Non-Durables,Food Distributors
DQ,DAQO New Energy Corp. American Depositary Shares each representing five ordinary shares,$71.73 ,6.62,10.17%,5273129093,China,2010,1644745,Technology,Semiconductors
DRD,DRDGOLD Limited American Depositary Shares,$11.38 ,0.86,8.18%,973119493,South Africa,,380430,Basic Industries,Precious Metals
DRE,Duke Realty Corporation Common Stock,$44.95 ,0.39,0.88%,16855587887,United States,,1465138,Consumer Services,Real Estate Investment Trusts
DRH,Diamondrock Hospitality Company Common Stock,$10.06 ,0.46,4.79%,2115132756,United States,2005,2027951,Consumer Services,Real Estate Investment Trusts
DRH^A,Diamondrock Hospitality Company 8.250% Series A Cumulative Redeemable Preferred Stock,$28.50 ,0.1,0.35%,,United States,,10605,,
DRI,Darden Restaurants Inc. Common Stock,$139.52 ,5.54,4.14%,18255169876,United States,,1148993,Consumer Services,Restaurants
DRIO,DarioHealth Corp. Common Stock,$14.52 ,0.62,4.46%,224703447,Israel,,309518,Health Care,Medical/Dental Instruments
DRNA,Dicerna Pharmaceuticals Inc. Common Stock,$26.22 ,1.11,4.42%,2016320832,United States,2014,628210,Health Care,Biotechnology: Commercial Physical & Biological Resarch
DRQ,Dril-Quip Inc. Common Stock,$34.32 ,1.02,3.06%,1215947098,United States,1997,100910,Energy,Metal Fabrications
DRRX,DURECT Corporation Common Stock,$1.72 ,0.04,2.38%,391138633,United States,2000,431614,Health Care,Major Pharmaceuticals
DRTT,DIRTT Environmental Solutions Ltd. Common Shares,$3.23 ,0.06,1.89%,273564569,Canada,,29558,,
DRUA,Dominion Energy Inc. 2016 Series A 5.25% Enhanced Junior Subordinated Notes due 2076,$25.31 ,0.06,0.24%,0,United States,2016,34899,,
DRVN,Driven Brands Holdings Inc. Common Stock,$28.13 ,0.46,1.66%,4709295059,United States,2021,261819,,
DS,Drive Shack Inc.,$2.57 ,0.04,1.58%,236620355,United States,,1477570,Consumer Services,Movies/Entertainment
DS^B,Drive Shack Inc. Preferred Series B,$24.98 ,0,0.00%,,United States,,1489,,
DS^C,Drive Shack Inc. Preferred Series C,$23.48 ,0,0.00%,,United States,,109,,
DS^D,Drive Shack Inc. Pfd Ser D,$22.73 ,0.19,0.84%,,United States,,5928,,
DSAC,Duddell Street Acquisition Corp. Class A Ordinary Shares,$9.69 ,-0.045,-0.46%,211968750,Hong Kong,2020,75159,Finance,Business Services
DSACU,Duddell Street Acquisition Corp. Unit,$10.10 ,-0.2187,-2.12%,0,Hong Kong,2020,151117,Finance,Business Services
DSACW,Duddell Street Acquisition Corp. Warrant,$0.95 ,-0.1099,-10.37%,0,Hong Kong,2020,71414,Finance,Business Services
DSE,Duff & Phelps Select MLP and Midstream Energy Fund Inc.,$8.42 ,0.12,1.45%,22088649,United States,2014,9081,,
DSEP,FT Cboe Vest U.S. Equity Deep Buffer ETF - September,$31.99 ,0.0972,0.31%,,United States,2020,237,,
DSEY,Diversey Holdings Ltd. Ordinary Shares,$17.02 ,0.39,2.35%,5174222236,United States,2021,1716524,Consumer Durables,Specialty Chemicals
DSGN,Design Therapeutics Inc. Common Stock,$22.99 ,0.7,3.14%,1278642233,United States,2021,191304,Health Care,Major Pharmaceuticals
DSGX,Descartes Systems Group Inc. (The) Common Stock,$58.22 ,0.56,0.97%,4920431570,Canada,,120069,,
DSKE,Daseke Inc. Common Stock,$5.99 ,0.34,6.02%,390510077,United States,2015,403121,,
DSKEW,Daseke Inc. Warrant,$0.12 ,0.0071,6.34%,0,United States,2015,27091,,
DSL,DoubleLine Income Solutions Fund Common Shares of Beneficial Interests,$17.85 ,0.06,0.34%,1820643380,,2013,181782,,
DSM,BNY Mellon Strategic Municipal Bond Fund Inc. Common Stock,$7.97 ,0.01,0.13%,393889443,United States,1989,80009,,
DSOC,Innovator Double Stacker ETF - October,$29.90 ,0.2964,1.00%,0,,2020,1,,
DSP,Viant Technology Inc. Class A Common Stock,$27.38 ,3.29,13.66%,1613655605,United States,2021,382134,Technology,EDP Services
DSPG,DSP Group Inc. Common Stock,$14.94 ,-0.02,-0.13%,361948123,United States,1994,129067,Technology,Semiconductors
DSS,Document Security Systems Inc. Common Stock,$2.73 ,0.18,7.06%,75539441,United States,,494975,Consumer Services,Recreational Products/Toys
DSSI,Diamond S Shipping Inc. Common Stock ,$10.51 ,0.12,1.16%,426651653,,2019,219720,Consumer Services,Transportation Services
DSU,Blackrock Debt Strategies Fund Inc. Common Stock,$10.89 ,0.03,0.28%,507384778,United States,1998,63609,,
DSWL,Deswell Industries Inc. Common Shares,$3.87 ,-0.01,-0.26%,61591975,Macau,1995,2203,Consumer Non-Durables,Plastic Products
DSX,Diana Shipping inc. common stock,$3.74 ,-0.03,-0.80%,342340907,Greece,2005,952988,Transportation,Marine Transportation
DSX^B,Diana Shipping Inc. Perpetual Preferred Shares Series B (Marshall Islands),$25.65 ,-0.025,-0.10%,,Greece,,1861,,
DT,Dynatrace Inc. Common Stock,$46.68 ,2.16,4.85%,13191478724,United States,2019,1499322,Technology,EDP Services
DTB,DTE Energy Company 2020 Series G 4.375% Junior Subordinated Debentures due 2080,$25.32 ,0.23,0.92%,0,United States,2020,27766,Public Utilities,Electric Utilities: Central
DTE,DTE Energy Company Common Stock,$141.12 ,0.86,0.61%,27338805184,United States,,714714,Public Utilities,Electric Utilities: Central
DTEA,DAVIDsTEA Inc. Common Stock,$3.44 ,0.01,0.29%,90319845,Canada,2015,74689,,
DTF,DTF Tax-Free Income Inc. Common Stock,$14.66 ,-0.03,-0.20%,103053438,United States,1991,585,,
DTIL,Precision BioSciences Inc. Common Stock,$9.50 ,0.23,2.48%,542844497,United States,2019,814901,Health Care,Major Pharmaceuticals
DTJ,DTE Energy Company 2016 Series B 5.375% Junior Subordinated Debentures due 2076,$25.00 ,-0.38,-1.50%,0,United States,2016,92170,,
DTLA^,Brookfield DTLA Inc. 7.625% Series A Cumulative Redeemable Preferred Stock,$13.83 ,0.08,0.58%,,,,220,,
DTOC,Digital Transformation Opportunities Corp. Class A Common Stock,$9.60 ,0,0.00%,0,United States,2021,16,Finance,Business Services
DTOCU,Digital Transformation Opportunities Corp. Units,$10.00 ,0.03,0.30%,0,United States,2021,1400,,
DTOCW,Digital Transformation Opportunities Corp. Warrant,$0.90 ,-0.1,-10.00%,0,United States,2021,500,Finance,Business Services
DTP,DTE Energy Company 6.25% Corporate Units,$51.51 ,0.18,0.35%,0,United States,,47415,Public Utilities,Electric Utilities: Central
DTSS,Datasea Inc. Common Stock,$2.64 ,-0.03,-1.12%,56681977,China,,66090,Technology,Retail: Computer Software & Peripheral Equipment
DTST,Data Storage Corporation Common Stock,$5.48 ,-2.32,-29.74%,,United States,,562664,,
DTSTW,Data Storage Corporation Warrant,$0.81 ,0.81,,0,United States,,54780,,
DTW,DTE Energy Company 2017 Series E 5.25% Junior Subordinated Debentures due 2077,$25.94 ,-0.08,-0.31%,0,United States,2017,10617,,
DTY,DTE Energy Company 2016 Series F 6.00% Junior Subordinated Debentures due 2076,$25.89 ,0.06,0.23%,0,United States,2016,119684,,
DUDE,Merlyn.AI SectorSurfer Momentum ETF,$26.69 ,0.581,2.23%,,United States,2020,12679,,
DUK,Duke Energy Corporation (Holding Company) Common Stock,$103.06 ,0.06,0.06%,79275705605,United States,,2408702,Public Utilities,Power Generation
DUK^A,Duke Energy Corporation Depositary Shares each representing a 1/1000th interest in a share of 5.75% Series A Cumulative Redeemable Perpetual Preferred Stock,$27.80 ,0.2,0.73%,,United States,,40561,,
DUKB,Duke Energy Corporation 5.625% Junior Subordinated Debentures due 2078,$26.99 ,0.12,0.45%,0,United States,2018,14857,,
DUKH,Duke Energy Corporation 5.125% Junior Subordinated Debentures due 2073,$25.95 ,0.19,0.74%,0,United States,,19350,Public Utilities,Power Generation
DUNE,Dune Acquisition Corporation Class A Common Stock,$9.76 ,0.005,0.05%,,United States,2021,6189,,
DUNEU,Dune Acquisition Corporation Unit,$9.98 ,-0.05,-0.50%,0,United States,2020,5628,,
DUNEW,Dune Acquisition Corporation Warrant,$0.62 ,-0.0132,-2.09%,0,United States,2021,6454,Finance,Business Services
DUO,Fangdd Network Group Ltd. American Depositary Shares,$3.13 ,-0.01,-0.32%,249920368,China,2019,115841,Technology,Computer Software: Programming Data Processing
DUOT,Duos Technologies Group Inc. Common Stock,$9.75 ,0.84,9.43%,34456646,United States,,30164,Technology,Computer Software: Prepackaged Software
DV,DoubleVerify Holdings Inc. Common Stock,$30.86 ,1.15,3.87%,4835130913,,2021,533463,Technology,Computer Software: Prepackaged Software
DVA,DaVita Inc. Common Stock,$125.41 ,-0.53,-0.42%,13318542000,United States,,302454,Health Care,Medical/Nursing Services
DVAX,Dynavax Technologies Corporation Common Stock,$7.80 ,0.47,6.41%,893788054,United States,2004,3409226,Health Care,Major Pharmaceuticals
DVD,Dover Motorsports Inc. Common Stock,$2.18 ,0.06,2.83%,79451388,United States,1996,25379,Consumer Services,Services-Misc. Amusement & Recreation
DVN,Devon Energy Corporation Common Stock,$26.38 ,1.63,6.59%,17856622000,United States,,10099687,Energy,Oil & Gas Production
DWIN,Delwinds Insurance Acquisition Corp. Class A Common Stock,$9.80 ,0.01,0.10%,252729750,,2021,48451,,
DWSN,Dawson Geophysical Company Common Stock,$2.40 ,0.18,8.11%,56347373,United States,,46395,Energy,Oil & Gas Production
DX,Dynex Capital Inc. Common Stock,$19.31 ,0.19,0.99%,596284477,United States,,418060,Consumer Services,Real Estate Investment Trusts
DX^C,Dynex Capital Inc. 6.900% Series C Fixed-to-Floating Rate Cumulative Redeemable Preferred Stock,$25.34 ,0.03,0.12%,,United States,,15686,,
DXC,DXC Technology Company Common Stock ,$36.86 ,1.35,3.80%,9384334582,,,2072797,Technology,EDP Services
DXCM,DexCom Inc. Common Stock,$333.25 ,9.29,2.87%,32227232177,United States,2005,804798,Health Care,Medical/Dental Instruments
DXF,Dunxin Financial Holdings Limited American Depositary Shares,$1.61 ,0.01,0.63%,33615491,China,,342388,Consumer Non-Durables,Apparel
DXPE,DXP Enterprises Inc. Common Stock,$31.51 ,0.48,1.55%,605210144,United States,,40387,Capital Goods,Industrial Machinery/Components
DXR,Daxor Corporation Common Stock,$9.49 ,0.5,5.56%,38281493,United States,,7262,Health Care,Medical/Dental Instruments
DXYN,Dixie Group Inc. (The) Common Stock,$3.14 ,-0.01,-0.32%,49027740,United States,,25905,Consumer Durables,Home Furnishings
DY,Dycom Industries Inc. Common Stock,$92.07 ,1.72,1.90%,2819308891,United States,,286850,Basic Industries,Water Supply
DYAI,Dyadic International Inc. Common Stock,$3.73 ,-0.11,-2.87%,102777006,United States,,150059,Health Care,Biotechnology: Biological Products (No Diagnostic Substances)
DYFN,Angel Oak Dynamic Financial Strategies Income Term Trust Common Shares of Beneficial Interest,$19.60 ,-0.0117,-0.06%,79478000,,2020,4182,Finance,Finance/Investors Services
DYN,Dyne Therapeutics Inc. Common Stock,$17.47 ,0.49,2.89%,898777395,United States,2020,143767,Consumer Durables,Specialty Chemicals
DYNT,Dynatronics Corporation Common Stock,$1.08 ,0.05,4.85%,16172469,United States,,125206,Health Care,Medical/Dental Instruments
DZSI,DZS Inc. Common Stock,$15.86 ,0.57,3.73%,426914500,United States,,92578,Public Utilities,Telecommunications Equipment
E,ENI S.p.A. Common Stock,$25.44 ,0.52,2.09%,45442831548,Italy,,393050,Energy,Oil & Gas Production
EA,Electronic Arts Inc. Common Stock,$138.62 ,-0.51,-0.37%,39870719863,United States,,2494404,Technology,Computer Software: Prepackaged Software
EAC,Edify Acquisition Corp. Class A Common Stock,$9.69 ,-0.04,-0.41%,334305000,United States,2021,345,,
EACPU,Edify Acquisition Corp. Units,$9.94 ,-0.0103,-0.10%,0,United States,2021,3613,,
EACPW,Edify Acquisition Corp. Warrant,$0.49 ,-0.0001,-0.02%,0,United States,2021,93850,Finance,Business Services
EAD,Wells Fargo Income Opportunities Fund Common Shares,$8.50 ,0.03,0.35%,514982819,United States,2003,156276,,
EAF,GrafTech International Ltd. Common Stock,$13.72 ,0.7,5.38%,3666792657,United States,2018,4262007,Consumer Durables,Metal Fabrications
EAI,Entergy Arkansas LLC First Mortgage Bonds 4.875% Series Due September 1 2066,$25.61 ,0.05,0.20%,0,United States,2016,13738,,
EAR,Eargo Inc. Common Stock,$34.48 ,1.82,5.57%,1320426151,United States,2020,1849473,Health Care,Medical Specialities
EARN,Ellington Residential Mortgage REIT Common Shares of Beneficial Interest,$12.01 ,0.33,2.83%,148245939,United States,2013,93757,Consumer Services,Real Estate Investment Trusts
EARS,Auris Medical Holding Ltd. Common Shares 0.01 SF (Bermuda),$3.11 ,0.1,3.32%,22048382,Bermuda,2014,620892,Health Care,Major Pharmaceuticals
EAST,Eastside Distilling Inc. Common Stock,$1.71 ,-0.0301,-1.73%,21427349,United States,,104608,Consumer Non-Durables,Beverages (Production/Distribution)
EAT,Brinker International Inc. Common Stock,$63.55 ,1.76,2.85%,2907470839,United States,,621968,Consumer Services,Restaurants
EB,Eventbrite Inc. Class A Common Stock,$20.61 ,0.8,4.04%,1931554010,United States,2018,3550388,Technology,EDP Services
EBACU,European Biotech Acquisition Corp. Units,$10.00 ,0,0.00%,0,Netherlands,2021,33,Finance,Business Services
EBACW,European Biotech Acquisition Corp. Warrant,$0.75 ,0.75,,0,Netherlands,2021,6624,,
EBAY,eBay Inc. Common Stock,$60.86 ,2.12,3.61%,41461583167,United States,1998,6562913,Consumer Services,Catalog/Specialty Distribution
EBC,Eastern Bankshares Inc. Common Stock,$21.68 ,0.29,1.36%,4048916779,United States,2020,560316,Finance,Major Banks
EBET,Esports Technologies Inc. Common Stock,$20.99 ,0.11,0.53%,273893661,United States,2021,114507,Consumer Services,Services-Misc. Amusement & Recreation
EBF,Ennis Inc. Common Stock,$21.53 ,0.13,0.61%,562003705,United States,,52012,Consumer Services,Office Equipment/Supplies/Services
EBIX,Ebix Inc. Common Stock,$28.53 ,1.22,4.47%,882800110,United States,,324759,Technology,EDP Services
EBMT,Eagle Bancorp Montana Inc. Common Stock,$23.03 ,0.07,0.31%,156038544,United States,,7321,Finance,Savings Institutions
EBON,Ebang International Holdings Inc. Class A Ordinary Shares,$2.75 ,0.34,14.11%,511047177,China,2020,10210213,Technology,Semiconductors
EBR,Centrais Electricas Brasileiras S A American Depositary Shares (Each representing one Common Share),$7.54 ,0.03,0.40%,11829739061,,2016,955640,Public Utilities,Electric Utilities: Central
EBS,Emergent Biosolutions Inc. Common Stock,$62.00 ,3.5,5.98%,3322299636,United States,2006,488828,Health Care,Major Pharmaceuticals
EBSB,Meridian Bancorp Inc. Common Stock,$21.68 ,0.54,2.55%,1137208595,United States,,351601,Finance,Major Banks
EBTC,Enterprise Bancorp Inc Common Stock,$34.50 ,0.03,0.09%,414205862,United States,,22357,Finance,Major Banks
EC,Ecopetrol S.A. American Depositary Shares,$12.99 ,0.63,5.10%,26705293195,Colombia,,938600,Energy,Oil & Gas Production
ECC           ,Eagle Point Credit Company Inc. Common Stock,$13.51 ,0.81,6.38%,437114564,United States,2014,841846,Finance,Trusts Except Educational Religious and Charitable
ECCB,Eagle Point Credit Company Inc. 7.75% Series B Term Preferred Stock due 2026,$25.63 ,0.1383,0.54%,0,United States,2016,7303,Finance,Trusts Except Educational Religious and Charitable
ECCW,Eagle Point Credit Company Inc. 6.75% Notes due 2031,$25.60 ,-0.28,-1.08%,0,United States,2021,10574,Finance,Trusts Except Educational Religious and Charitable
ECCX,Eagle Point Credit Company Inc. 6.6875% Notes due 2028,$25.47 ,0.0199,0.08%,0,United States,2018,4277,,
ECCY,Eagle Point Credit Company Inc. 6.75% Notes due 2027,$25.46 ,-0.08,-0.31%,0,United States,2017,2000,,
ECF,Ellsworth Growth and Income Fund Ltd.,$13.81 ,0.18,1.32%,186427515,United States,1986,25999,,
ECF^A,Ellsworth Growth and Income Fund Ltd. 5.25% Series A Cumulative Preferred Shares (Liquidation Preference $25.00 per share),$25.97 ,0.0036,0.01%,,United States,,3595,,
ECHO,Echo Global Logistics Inc. Common Stock,$36.18 ,-0.07,-0.19%,963674308,United States,2009,158006,Transportation,Oil Refining/Marketing
ECL,Ecolab Inc. Common Stock,$224.06 ,2.58,1.17%,64067132948,United States,,702275,Consumer Non-Durables,Package Goods/Cosmetics
ECOL,US Ecology Inc Common Stock,$42.15 ,0.15,0.36%,1328244457,United States,,103488,Public Utilities,Environmental Services
ECOLW,US Ecology Inc. Warrant,$9.97 ,0,0.00%,0,United States,,10,Public Utilities,Environmental Services
ECOM          ,ChannelAdvisor Corporation Common Stock,$24.44 ,1.43,6.22%,726670903,United States,2013,257258,Technology,Computer Software: Prepackaged Software
ECOR,electroCore Inc. Common Stock,$1.59 ,0.03,1.92%,77185571,United States,2018,172341,Health Care,Medical/Dental Instruments
ECPG,Encore Capital Group Inc Common Stock,$43.23 ,0.75,1.77%,1340555599,United States,,285829,,
ED,Consolidated Edison Inc. Common Stock,$78.97 ,-0.31,-0.39%,27071962984,United States,,1535515,Public Utilities,Power Generation
EDAP,EDAP TMS S.A. American Depositary Shares,$5.97 ,0.04,0.68%,199076432,France,1997,223490,Health Care,Biotechnology: Electromedical & Electrotherapeutic Apparatus
EDD,Morgan Stanley Emerging Markets Domestic Debt Fund Inc. Morgan Stanley Emerging Markets Domestic Debt Fund Inc. Common Stock,$6.12 ,0.04,0.66%,404483805,United States,2007,36392,,
EDF,Stone Harbor Emerging Markets Income Fund Common Shares of Beneficial Interest,$8.16 ,-0.05,-0.61%,136075099,United States,2010,68651,,
EDI,Stone Harbor Emerging Markets Total Income Fund Common Shares of Beneficial Interests,$8.61 ,-0.095,-1.09%,85001550,United States,2012,26856,,
EDIT,Editas Medicine Inc. Common Stock,$33.22 ,1.82,5.80%,2253194204,United States,2016,1424080,Health Care,Major Pharmaceuticals
EDN,Empresa Distribuidora Y Comercializadora Norte S.A. (Edenor) Empresa Distribuidora Y Comercializadora Norte S.A. (Edenor) American Depositary Shares,$3.57 ,0.05,1.42%,161802235,Argentina,2007,79173,Public Utilities,Electric Utilities: Central
EDR,Endeavor Group Holdings Inc. Class A Common Stock,$31.95 ,1.39,4.55%,21784980627,,2021,857397,Consumer Services,Movies/Entertainment
EDRY,EuroDry Ltd. Common Shares ,$13.44 ,0.67,5.25%,30974227,Greece,,36474,Consumer Services,Marine Transportation
EDSA,Edesa Biotech Inc. Common Shares,$6.01 ,0.14,2.39%,79202436,United States,,118194,,
EDTK,Skillful Craftsman Education Technology Limited Ordinary Share,$1.94 ,0.03,1.57%,23280000,China,2020,402614,Consumer Services,Other Consumer Services
EDTX,EdtechX Holdings Acquisition Corp. II Class A common stock,$9.91 ,0.02,0.20%,78350938,United Kingdom,2021,4953,,
