Symbol,Name,Last Sale,Net Change,% Change,Market Cap,Country,IPO Year,Volume,Sector,Industry
PSMR,Pacer Swan SOS Moderate (April) ETF,$21.16 ,0.1682,0.80%,,United States,2021,244,,
PSMT,PriceSmart Inc. Common Stock,$89.68 ,2.18,2.49%,2757614891,United States,,68954,Consumer Services,Department/Specialty Retail Stores
PSN,Parsons Corporation Common Stock,$42.27 ,0.55,1.32%,4328811860,,2019,222980,Capital Goods,Industrial Machinery/Components
PSNL,Personalis Inc. Common Stock,$19.74 ,1.59,8.76%,866751401,United States,2019,995005,Health Care,Biotechnology: In Vitro & In Vivo Diagnostic Substances
PSO,Pearson Plc Common Stock,$12.19 ,0.22,1.84%,9218496970,United Kingdom,,176787,Consumer Services,Books
PSTG,Pure Storage Inc. Class A Common Stock,$18.03 ,0.85,4.95%,5107717204,,2015,4860528,Technology,Electronic Components
PSTH,Pershing Square Tontine Holdings Ltd. Class A Common Stock,$24.94 ,0.44,1.80%,4988002494,,2020,2357879,,
PSTI,Pluristem Therapeutics Inc. Common Stock,$3.65 ,0.11,3.11%,115851891,Israel,,284624,Health Care,Biotechnology: Biological Products (No Diagnostic Substances)
PSTL,Postal Realty Trust Inc. Class A Common Stock,$20.25 ,-0.31,-1.51%,270759146,,2019,148905,Consumer Services,Real Estate Investment Trusts
PSTV,PLUS THERAPEUTICS Inc. Common Stock ,$2.17 ,0.13,6.37%,45800491,United States,,377580,Health Care,Medical/Dental Instruments
PSTX,Poseida Therapeutics Inc. Common Stock,$8.40 ,0.09,1.08%,522099572,United States,2020,100451,Consumer Durables,Specialty Chemicals
PSX,Phillips 66 Common Stock,$87.70 ,3.35,3.97%,38400940636,United States,,2818162,Energy,Integrated oil Companies
PSXP,Phillips 66 Partners LP Common Units representing limited partner interest in the Partnership,$36.06 ,0.06,0.17%,8233945665,United States,2013,568543,Energy,Oil & Gas Production
PT,Pintec Technology Holdings Limited American Depositary Shares,$0.80 ,0.0104,1.32%,34668712,China,2018,176956,Technology,Computer Software: Programming Data Processing
PTA,Cohen & Steers Tax-Advantaged Preferred Securities and Income Fund Common Shares of Beneficial Interest,$25.00 ,0.05,0.20%,1381836425,,2020,94610,,
PTC,PTC Inc. Common Stock,$129.01 ,3.62,2.89%,15075438522,United States,,741724,Technology,Computer Software: Prepackaged Software
PTCT,PTC Therapeutics Inc. Common Stock,$37.99 ,-0.4,-1.04%,2676619945,United States,2013,695526,Health Care,Major Pharmaceuticals
PTE,PolarityTE Inc. Common Stock,$0.98 ,-0.2633,-21.23%,78713574,United States,,9087713,Consumer Durables,Specialty Chemicals
PTEN,Patterson-UTI Energy Inc. Common Stock,$8.52 ,0.47,5.84%,1606156431,United States,1993,1531867,Energy,Oil & Gas Production
PTGX,Protagonist Therapeutics Inc. Common Stock,$30.47 ,1.47,5.07%,1339009208,United States,2016,239212,Health Care,Major Pharmaceuticals
PTIC,PropTech Investment Corporation II Class A Common Stock,$9.80 ,0.03,0.31%,281750000,United States,2021,255,,
PTICU,PropTech Investment Corporation II Unit,$10.06 ,0,0.00%,0,United States,2020,2,,
PTICW,PropTech Investment Corporation II Warrant,$0.79 ,0.0799,11.25%,0,United States,2021,3800,Finance,Business Services
PTIX,Protagenic Therapeutics Inc. Common Stock,$2.19 ,-0.15,-6.41%,30179521,United States,,1572916,Health Care,Major Pharmaceuticals
PTIXW,Protagenic Therapeutics Inc. Warrant,$0.30 ,0.0397,15.26%,0,United States,,87771,,
PTK,PTK Acquisition Corp. Common Stock,$9.83 ,0,0.00%,141306250,United States,2020,9537,,
PTMN,Portman Ridge Finance Corporation Common Stock,$2.43 ,0.01,0.41%,182724193,United States,,434184,Finance,Finance/Investors Services
PTN,Palatin Technologies Inc. Common Stock,$0.51 ,0.0249,5.16%,116704208,United States,,1505745,Health Care,Major Pharmaceuticals
PTNR,Partner Communications Company Ltd. American Depositary Shares,$4.66 ,0.03,0.65%,856393951,Israel,,871,Public Utilities,Telecommunications Equipment
PTOC,Pine Technology Acquisition Corp. Class A Common Stock,$9.69 ,0,0.00%,417881250,United States,2021,10,Finance,Business Services
PTOCU,Pine Technology Acquisition Corp. Unit,$10.00 ,0.04,0.40%,0,United States,2021,1103,,
PTOCW,Pine Technology Acquisition Corp. Warrant,$0.80 ,0.7999,,0,United States,2021,1450,Finance,Business Services
PTON,Peloton Interactive Inc. Class A Common Stock,$96.58 ,1.29,1.35%,28809164306,United States,2019,18728962,Consumer Services,Other Consumer Services
PTPI,Petros Pharmaceuticals Inc. Common Stock,$2.96 ,0.01,0.34%,28914053,United States,,30949,Health Care,Major Pharmaceuticals
PTR,PetroChina Company Limited Common Stock,$40.39 ,0.48,1.20%,73922172933,China,,116060,Energy,Oil & Gas Production
PTRS,Partners Bancorp Common Stock,$8.20 ,0.09,1.11%,145358514,United States,,24825,Finance,Major Banks
PTSI,P.A.M. Transportation Services Inc. Common Stock,$57.29 ,0.74,1.31%,328056461,United States,1986,3852,Transportation,Trucking Freight/Courier Services
PTVCA,Protective Insurance Corporation Class A Common Stock,$23.07 ,0,0.00%,326582404,United States,,21,Finance,Property-Casualty Insurers
PTVCB,Protective Insurance Corporation Class B Common Stock,$23.20 ,0.1,0.43%,328422703,United States,,21191,Finance,Property-Casualty Insurers
PTVE,Pactiv Evergreen Inc. Common stock,$14.71 ,0.27,1.87%,2605989914,United States,2020,495405,Consumer Durables,Containers/Packaging
PTY,Pimco Corporate & Income Opportunity Fund,$18.90 ,0.55,3.00%,2090655838,United States,2002,396735,,
PUBM,PubMatic Inc. Class A Common Stock,$33.83 ,-0.49,-1.43%,1617970630,United States,2020,1395248,Technology,Computer Software: Prepackaged Software
PUCK,Goal Acquisitions Corp. Common Stock,$9.65 ,-0.01,-0.10%,320006063,United States,2021,10171,,
PUCKU,Goal Acquisitions Corp. Unit,$10.14 ,0,0.00%,0,United States,2021,82464,,
PUCKW,Goal Acquisitions Corp. Warrant,$0.48 ,0.0058,1.23%,0,United States,2021,58282,Finance,Business Services
PUK,Prudential Public Limited Company Common Stock,$43.20 ,1.47,3.52%,56497147618,United Kingdom,,175796,Finance,Life Insurance
PUK^,Prudential Public Limited Company 6.75% Perpetual Subordinated Captial Security,$27.34 ,0.14,0.52%,,United Kingdom,,7085,,
PUK^A,Prudential Public Limited Company 6.50% Perpetual Subordinated Capital Securities Exchangeable at the Issuer's Option Into Non-Cumulative Dollar Denominated Preference Shares,$27.10 ,0.37,1.38%,,United Kingdom,,8858,,
PULM,Pulmatrix Inc. Common Stock,$0.87 ,0.0421,5.07%,49099806,United States,2014,1359541,Health Care,Major Pharmaceuticals
PUMP,ProPetro Holding Corp. Common Stock,$10.57 ,0.33,3.22%,1081103099,United States,2017,759051,Energy,Oilfield Services/Equipment
PUYI,Puyi Inc. American Depository Shares,$5.48 ,0.0563,1.04%,330301260,China,2019,3267,Finance,Investment Managers
PV,Primavera Capital Acquisition Corporation Class A Ordinary Shares,$9.75 ,-0.03,-0.31%,524062500,,2021,127885,Finance,Business Services
PVAC,Penn Virginia Corporation Common Stock,$17.48 ,-0.1,-0.57%,267615671,United States,,364852,Energy,Oil & Gas Production
PVBC,Provident Bancorp Inc. (MD) Common Stock,$16.70 ,0.1,0.60%,310461601,United States,2015,30346,Finance,Major Banks
PVG,Pretium Resources Inc. Ordinary Shares (Canada),$11.19 ,0.38,3.52%,2101852210,Canada,,551201,,
PVH,PVH Corp. Common Stock,$113.36 ,5.72,5.31%,8078708999,United States,,965174,,
PVL,Permianville Royalty Trust Trust Units ,$1.59 ,0,0.00%,52470000,United States,2011,103121,Energy,Oil & Gas Production
PW,Power REIT (MD) Common Stock,$39.13 ,2.23,6.04%,129110726,United States,,22281,Consumer Services,Real Estate Investment Trusts
PW^A,Power REIT 7.75% Series A Cumulative Perpetual Preferred Stock,$27.47 ,0,0.00%,,United States,,8,,
PWFL,PowerFleet Inc. Common Stock,$6.51 ,0.16,2.52%,234264134,United States,,135439,Capital Goods,Telecommunications Equipment
PWOD,Penns Woods Bancorp Inc. Common Stock,$24.98 ,0.55,2.25%,176379508,United States,,17012,Finance,Major Banks
PWR,Quanta Services Inc. Common Stock,$97.42 ,1.4,1.46%,13575096283,United States,,575875,Capital Goods,Engineering & Construction
PXD,Pioneer Natural Resources Company Common Stock,$157.05 ,5.18,3.41%,38312724577,United States,,1985218,Energy,Oil & Gas Production
PXLW,Pixelworks Inc.  Common Stock,$3.15 ,0.25,8.62%,164469126,United States,2000,3367558,Technology,Semiconductors
PXS,Pyxis Tankers Inc. Common Stock,$0.81 ,-0.0291,-3.47%,17463507,Greece,,2275872,Transportation,Marine Transportation
PXSAP,Pyxis Tankers Inc. 7.75% Series A Cumulative Convertible Preferred Shares,$23.19 ,0.2144,0.93%,0,Greece,,992,Transportation,Marine Transportation
PXSAW,Pyxis Tankers Inc. Warrant,$0.35 ,-0.0122,-3.41%,0,Greece,,3751,Transportation,Marine Transportation
PYN,PIMCO New York Municipal Income Fund III Common Shares of Beneficial Interest,$10.80 ,0.21,1.98%,61862400,United States,2002,5189,,
PYPD,PolyPid Ltd. Ordinary Shares,$9.05 ,0.65,7.74%,169643535,Israel,2020,20607,Health Care,Medical/Dental Instruments
PYPL,PayPal Holdings Inc. Common Stock,$246.29 ,5.49,2.28%,2.89324E+11,United States,,6721357,Miscellaneous,Business Services
PYR,PyroGenesis Canada Inc. Common Shares,$4.21 ,0.12,2.93%,692538016,Canada,,190560,,
PYS,Merrill Lynch Depositor Inc PPlus Tr Ser RRD-1 Tr Ctf Cl A,$22.05 ,-0.0001,0.00%,0,United States,,682,Finance,Trusts Except Educational Religious and Charitable
PYT,PPlus Tr GSC-2 Tr Ctf Fltg Rate,$24.00 ,0,0.00%,0,United States,,1050,,
PZC,PIMCO California Municipal Income Fund III Common Shares of Beneficial Interest,$11.24 ,0.03,0.27%,251562440,United States,2002,26938,,
PZG,Paramount Gold Nevada Corp. Common Stock,$1.04 ,0.03,2.97%,39204277,United States,2015,90032,Basic Industries,Precious Metals
PZN,Pzena Investment Management Inc Class A Common Stock,$11.34 ,0.17,1.52%,822915665,United States,2007,50984,Finance,Investment Managers
PZZA,Papa John's International Inc. Common Stock,$96.65 ,0.11,0.11%,3196664053,United States,1993,419943,Consumer Services,Restaurants
QADA,QAD Inc. Class A Common Stock,$64.64 ,0.7,1.10%,1338772938,United States,,31477,Technology,Computer Software: Prepackaged Software
QADB,QAD Inc. Class B Common Stock,$46.20 ,-0.67,-1.43%,956858133,United States,,640,Technology,Computer Software: Prepackaged Software
QCOM,QUALCOMM Incorporated Common Stock,$130.15 ,3.04,2.39%,1.46809E+11,United States,1991,9385859,Technology,Computer peripheral equipment
QCON,American Century ETF Trust American Century Quality Convertible Securities ETF,$45.33 ,0.8614,1.94%,,,2021,341,,
QCRH,QCR Holdings Inc. Common Stock,$47.60 ,0.8,1.71%,754313297,United States,,24572,Finance,Major Banks
QD,Qudian Inc. American Depositary Shares each representing one Class A Ordinary Share,$1.89 ,0.09,5.00%,478336694,China,2017,1144728,Technology,Computer Software: Prepackaged Software
QDEC,FT Cboe Vest Growth-100 Buffer ETF - December,$20.79 ,0.2215,1.08%,,United States,2020,4714,,
QDEL,Quidel Corporation Common Stock,$118.21 ,1.71,1.47%,5029931959,United States,,561442,Health Care,Biotechnology: In Vitro & In Vivo Diagnostic Substances
QELL,Qell Acquisition Corp. Class A Ordinary Shares,$9.87 ,0,0.00%,419668097,United States,2020,889448,Finance,Business Services
QELLU,Qell Acquisition Corp. Unit,$10.26 ,0.045,0.44%,0,United States,2020,11176,Finance,Business Services
QELLW,Qell Acquisition Corp. Warrant,$1.33 ,0.05,3.91%,0,United States,2020,94299,Finance,Business Services
QFIN,360 DigiTech Inc. American Depositary Shares,$23.68 ,1.85,8.48%,3608737304,China,2018,1670453,Finance,Finance: Consumer Services
QFTA,Quantum FinTech Acquisition Corporation Common Stock,$9.70 ,-0.04,-0.41%,244015625,,2021,632,,
QGEN,Qiagen N.V. Common Shares ,$46.78 ,0.28,0.60%,10684879460,Netherlands,,503354,Health Care,Biotechnology: Biological Products (No Diagnostic Substances)
QH,Quhuo Limited American Depository Shares,$4.86 ,-0.23,-4.52%,252265153,China,2020,52059,Miscellaneous,Business Services
QIWI,QIWI plc American Depositary Shares,$10.63 ,0.19,1.82%,666638924,Cyprus,2013,199807,Miscellaneous,Business Services
QK,Q&K International Group Limited American Depositary Shares,$1.50 ,0,0.00%,81316997,China,2019,52622,Finance,Real Estate
QLGN,Qualigen Therapeutics Inc. Common Stock,$1.59 ,0.06,3.92%,45844564,United States,2015,938825,Health Care,Biotechnology: Commercial Physical & Biological Resarch
QLI,Qilian International Holding Group Ltd. Ordinary Shares,$4.25 ,-0.02,-0.47%,151937500,China,2021,36202,Health Care,Major Pharmaceuticals
QLYS,Qualys Inc. Common Stock,$99.83 ,2.77,2.85%,3907534579,United States,2012,242351,Technology,EDP Services
QMAR,FT Cboe Vest Growth-100 Buffer ETF - March,$20.71 ,0.2975,1.46%,,United States,2021,10919,,
QMCO,Quantum Corporation Common Stock,$8.72 ,0.28,3.32%,494103165,United States,,239721,Technology,Electronic Components
QNST,QuinStreet Inc. Common Stock,$18.03 ,0.14,0.78%,966759062,United States,2010,182072,Technology,Advertising
QPFF,American Century ETF Trust American Century Quality Preferred ETF,$40.65 ,0.2282,0.57%,,,2021,501,,
QQQX,Nuveen NASDAQ 100 Dynamic Overwrite Fund Shares of Beneficial Interest,$27.06 ,0.36,1.35%,1138304607,United States,,91304,Finance,Finance Companies
QRHC,Quest Resource Holding Corporation Common Stock,$3.28 ,0.05,1.55%,60396014,United States,,94376,Capital Goods,Building Products
QRTEA,Qurate Retail Inc. Series A Common Stock ,$13.20 ,0.12,0.92%,5397701998,United States,,3020304,Consumer Services,Catalog/Specialty Distribution
QRTEB,Qurate Retail Inc. Series B Common Stock ,$13.28 ,0.17,1.30%,5430415343,United States,,4603,Consumer Services,Catalog/Specialty Distribution
QRTEP,Qurate Retail Inc. 8.0% Fixed Rate Cumulative Redeemable Preferred Stock,$105.92 ,0.22,0.21%,0,United States,,14605,Consumer Services,Catalog/Specialty Distribution
QRVO,Qorvo Inc. Common Stock,$171.01 ,4.16,2.49%,19369055524,United States,,1296185,Capital Goods,Industrial Machinery/Components
QS,QuantumScape Corporation Class A Common Stock,$27.29 ,0.74,2.79%,11079028904,United States,2020,11197567,Capital Goods,Auto Parts:O.E.M.
QSR,Restaurant Brands International Inc. Common Shares,$67.65 ,0.96,1.44%,20505611971,Canada,2014,828402,,
QTAP,Innovator Growth Accelerated Plus ETF - April,$26.36 ,0.4997,1.93%,,,2021,703,,
QTNT,Quotient Limited Ordinary Shares,$3.66 ,0.13,3.68%,370147706,Switzerland,2014,419944,Health Care,Biotechnology: In Vitro & In Vivo Diagnostic Substances
QTRX,Quanterix Corporation Common Stock,$45.69 ,2.39,5.52%,1660219163,United States,2017,407438,Health Care,Industrial Specialties
QTS,QTS Realty Trust Inc. Class A Common Stock,$62.64 ,0.69,1.11%,4316018148,United States,2013,357818,Consumer Services,Real Estate Investment Trusts
QTS^A,QTS Realty Trust Inc. 7.125% Series A Cumulative Redeemable Perpetual Preferred Stock,$27.30 ,0.15,0.55%,,United States,,1202,,
QTS^B,QTS Realty Trust Inc. 6.50% Series B Cumulative Convertible Perpetual Preferred Stock,$140.45 ,-0.6611,-0.47%,,United States,,131,,
QTT,Qutoutiao Inc. American Depositary Shares,$1.94 ,0.11,6.01%,557733999,China,2018,2073381,Technology,Computer Software: Prepackaged Software
QTWO,Q2 Holdings Inc. Common Stock,$93.99 ,2.6,2.85%,5292136087,,2014,710926,Technology,EDP Services
QUAD,Quad Graphics Inc Class A Common Stock,$3.65 ,0.39,11.96%,199583482,United States,,901405,Consumer Services,Recreational Products/Toys
QUIK,QuickLogic Corporation Common Stock,$5.72 ,0.41,7.72%,64466059,United States,1999,241590,Technology,Semiconductors
QUMU,Qumu Corporation Common Stock,$4.91 ,0.16,3.37%,86375605,United States,,101078,Technology,Retail: Computer Software & Peripheral Equipment
QUOT,Quotient Technology Inc. Common Stock,$12.11 ,0.76,6.70%,1130619027,,2014,783923,Technology,Advertising
QURE,uniQure N.V. Ordinary Shares,$32.44 ,0.74,2.33%,1492811625,Netherlands,2014,313080,Health Care,Major Pharmaceuticals
QVCC,QVC Inc. 6.250% Senior Secured Notes due 2068,$25.81 ,0.09,0.35%,0,United States,2019,58265,,
QVCD,QVC Inc. 6.375% Senior Secured Notes due 2067,$25.88 ,0.16,0.62%,0,United States,2018,10737,,
R,Ryder System Inc. Common Stock,$85.14 ,0.29,0.34%,4586524749,United States,,543416,Miscellaneous,Rental/Leasing Companies
RA,Brookfield Real Assets Income Fund Inc. Common Stock,$20.99 ,-0.07,-0.33%,921312034,,2016,298717,,
RAAC,Revolution Acceleration Acquisition Corp Class A Common Stock,$9.89 ,-0.03,-0.30%,379116663,United States,2021,166280,,
RAACU,Revolution Acceleration Acquisition Corp Unit,$10.38 ,-0.015,-0.14%,0,United States,2020,89018,,
RAACW,Revolution Acceleration Acquisition Corp Warrant,$1.55 ,0,0.00%,0,United States,2021,38856,Finance,Business Services
RAAS,Cloopen Group Holding Limited American Depositary Shares each representing two Class A Ordinary Shares,$9.30 ,0.76,8.90%,1528642618,,2021,460329,Technology,Computer Software: Prepackaged Software
RACA,Therapeutics Acquisition Corp. Class A Common Stock,$10.04 ,-0.02,-0.20%,175036356,United States,2020,9644,,
RACB,Research Alliance Corp. II Class A Common Stock,$10.81 ,-0.03,-0.28%,207406065,United States,2021,197,,
RACE,Ferrari N.V. Common Shares,$198.65 ,1.41,0.72%,49281385009,,2015,133213,Capital Goods,Auto Manufacturing
RAD,Rite Aid Corporation Common Stock,$19.13 ,2.08,12.20%,1054094775,United States,,2902552,Health Care,Medical/Nursing Services
RADA,RADA Electronic Industries Ltd. Ordinary Shares,$11.47 ,0.28,2.50%,498773696,Israel,,152780,,
RADI,Radius Global Infrastructure Inc. Class A Common Stock,$13.50 ,-0.16,-1.17%,826327467,United States,,455465,Consumer Services,Telecommunications Equipment
RAIL,FreightCar America Inc. Common Stock,$6.44 ,0.15,2.39%,100388472,United States,2005,1368096,Capital Goods,Railroads
RAIN,Rain Therapeutics Inc. Common Stock,$15.33 ,0.25,1.66%,398107223,United States,2021,185087,Health Care,Major Pharmaceuticals
RAMP,LiveRamp Holdings Inc. Common Stock,$50.06 ,1.61,3.32%,3349985715,United States,2018,736431,Technology,EDP Services
RAND,Rand Capital Corporation Common Stock,$18.41 ,0,0.00%,47543928,United States,,111,Finance,Finance/Investors Services
RAPT,RAPT Therapeutics Inc. Common Stock,$20.58 ,1.49,7.81%,514685364,United States,2019,149302,Health Care,Major Pharmaceuticals
RARE,Ultragenyx Pharmaceutical Inc. Common Stock,$110.88 ,4.17,3.91%,7482485435,United States,2014,281323,Health Care,Major Pharmaceuticals
RAVE,Rave Restaurant Group Inc. Common Stock,$1.34 ,-0.02,-1.47%,24126571,United States,,709871,Consumer Services,Restaurants
RAVN,Raven Industries Inc. Common Stock,$41.21 ,1.02,2.54%,1478182054,United States,,123628,Capital Goods,Office Equipment/Supplies/Services
RBA,Ritchie Bros. Auctioneers Incorporated Common Stock,$63.23 ,1.82,2.96%,6973043034,Canada,,342321,,
RBAC,RedBall Acquisition Corp. Class A Ordinary Shares,$9.90 ,0,0.00%,711562500,United States,2020,208009,Finance,Business Services
RBB,RBB Bancorp Common Stock,$23.08 ,1.08,4.91%,451726930,United States,2017,86678,Finance,Commercial Banks
RBBN,Ribbon Communications Inc. Common Stock,$6.97 ,0.2,2.95%,1027151259,United States,,353034,Technology,EDP Services
RBC,Regal Beloit Corporation Common Stock,$146.70 ,1.54,1.06%,5960408531,United States,,235061,Consumer Durables,Metal Fabrications
RBCAA,Republic Bancorp Inc. Class A Common Stock,$45.77 ,0.82,1.82%,951612171,United States,1998,20578,Finance,Major Banks
RBCN,Rubicon Technology Inc. Common Stock,$10.26 ,0,0.00%,25022652,United States,2007,2845,Technology,Semiconductors
RBKB,Rhinebeck Bancorp Inc. Common Stock,$10.26 ,0,0.00%,114227555,United States,2019,45,Finance,Major Banks
RBLX,Roblox Corporation Class A Common Stock,$70.95 ,1.27,1.82%,40363029300,,2021,7665235,Technology,EDP Services
RBNC,Reliant Bancorp Inc. Common Stock,$29.90 ,0.18,0.61%,490560928,United States,,17847,Finance,Major Banks
RC,Ready Capital Corproation Common Stock,$14.30 ,0.56,4.08%,1018470296,United States,2013,471195,Consumer Services,Real Estate Investment Trusts
RC^B,Ready Capital Corporation 8.625% Series B Cumulative Preferred Stock,$25.41 ,0.028,0.11%,,United States,,996,,
RC^C,Ready Capital Corporation 6.25% Series C Cumulative Convertible Preferred Stock,$25.15 ,0.0301,0.12%,,United States,,653,,
RC^D,Ready Capital Corporation 7.625% Series D Cumulative Redeemable Preferred Stock,$25.25 ,0,0.00%,,United States,,63,,
RCA,Ready Capital Corporation 7.00% Convertible Senior Notes due 2023,$25.99 ,0,0.00%,0,United States,2017,20,,
RCAT,Red Cat Holdings Inc. Common Stock,$3.14 ,-0.1,-3.09%,103657448,United States,,108998,Technology,Retail: Computer Software & Peripheral Equipment
RCB,Ready Capital Corporation 6.20% Senior Notes due 2026,$26.07 ,0.47,1.84%,0,United States,2019,4198,,
RCC,Ready Capital Corporation 5.75% Senior Notes due 2026,$25.55 ,-0.015,-0.06%,,United States,2021,1864,Finance,Finance Companies
RCEL,Avita Therapeutics Inc. Common Stock,$20.56 ,0.65,3.27%,510769674,Australia,,190439,Health Care,Medical Specialities
RCG,RENN Fund Inc Common Stock,$2.66 ,0.115,4.52%,15832203,United States,,17242,,
RCHG,Recharge Acquisition Corp. Class A Common Stock,$9.85 ,0.03,0.31%,246742500,United States,2020,145266,,
RCHGU,Recharge Acquisition Corp. Unit,$10.15 ,0.055,0.55%,0,United States,2020,5967,,
RCHGW,Recharge Acquisition Corp. Warrant,$0.74 ,0.0199,2.76%,0,United States,2020,17158,Finance,Business Services
RCI,Rogers Communication Inc. Common Stock,$51.13 ,0.48,0.95%,25816831509,Canada,,185517,,
RCII,Rent-A-Center Inc. Common Stock,$57.61 ,2.53,4.59%,3820081538,United States,1995,349459,Technology,Diversified Commercial Services
RCKT,Rocket Pharmaceuticals Inc. Common Stock,$40.91 ,-0.03,-0.07%,2593569388,United States,2015,518743,Health Care,Major Pharmaceuticals
RCKY,Rocky Brands Inc. Common Stock,$55.79 ,0.12,0.22%,406342783,United States,1993,64355,Consumer Non-Durables,Shoe Manufacturing
RCL,D/B/A Royal Caribbean Cruises Ltd. Common Stock,$84.27 ,5.81,7.41%,21452669265,United States,1993,4398346,,
RCLF,Rosecliff Acquisition Corp I Class A Common Stock,$9.85 ,0.15,1.55%,311506250,United States,2021,1844,,
RCLFU,Rosecliff Acquisition Corp I Unit,$9.92 ,-0.02,-0.20%,0,United States,2021,7467,,
RCLFW,Rosecliff Acquisition Corp I Warrants,$0.64 ,0,0.00%,0,United States,2021,56,Finance,Business Services
RCM,R1 RCM Inc. Common Stock,$24.82 ,0.74,3.07%,6492647717,United States,,1002132,Consumer Services,Other Consumer Services
RCMT,RCM Technologies Inc. Common Stock,$3.49 ,-0.02,-0.57%,38940778,United States,,499033,Consumer Services,Military/Government/Technical
RCON,Recon Technology Ltd. Class A Ordinary Shares,$9.60 ,0.67,7.50%,69147187,China,2009,444523,Energy,Oilfield Services/Equipment
RCS,PIMCO Strategic Income Fund Inc.,$7.53 ,0.04,0.53%,332720580,United States,1994,96972,,
RCUS,Arcus Biosciences Inc. Common Stock,$28.52 ,0.87,3.15%,2024801927,,2018,407510,Health Care,Major Pharmaceuticals
RDCM,Radcom Ltd. Ordinary Shares,$9.37 ,-0.015,-0.16%,130582338,Israel,1997,7445,Technology,Computer peripheral equipment
RDFI,Rareview Dynamic Fixed Income ETF,$29.00 ,0.0999,0.35%,,,2020,696,,
RDFN,Redfin Corporation Common Stock,$51.14 ,2.46,5.05%,5320682873,United States,2017,1634513,Finance,Real Estate
RDHL,Redhill Biopharma Ltd. American Depositary Shares,$6.22 ,0.24,4.01%,290270842,Israel,,141288,Health Care,Major Pharmaceuticals
RDI,Reading International Inc Class A Common Stock,$5.93 ,0.02,0.34%,129331041,United States,,8635,Consumer Services,Movies/Entertainment
RDIB,Reading International Inc Class B Common Stock,$19.60 ,-0.67,-3.31%,427468532,United States,,2609,Consumer Services,Movies/Entertainment
RDN,Radian Group Inc. Common Stock,$22.97 ,0.37,1.64%,4394541314,United States,,858664,Finance,Property-Casualty Insurers
RDNT,RadNet Inc. Common Stock,$23.52 ,0.05,0.21%,1239504917,United States,,182868,Health Care,Medical Specialities
RDS/B,Royal Dutch Shell PLC,$38.29 ,1.29,3.49%,,Netherlands,,4478711,,
RDUS,Radius Health Inc. Common Stock,$20.95 ,0.8,3.97%,989733706,United States,2014,273901,Health Care,Major Pharmaceuticals
RDVT,Red Violet Inc. Common Stock ,$20.09 ,0.99,5.18%,245936798,United States,,31924,Technology,Computer Software: Prepackaged Software
RDWR,Radware Ltd. Ordinary Shares,$28.07 ,0.39,1.41%,1278165766,Israel,1999,234017,Technology,EDP Services
RDY,Dr. Reddy's Laboratories Ltd Common Stock,$72.00 ,-0.54,-0.74%,11973688632,India,,260565,Health Care,Major Pharmaceuticals
RE,Everest Re Group Ltd. Common Stock,$271.43 ,0.47,0.17%,10879871191,Bermuda,,191685,Finance,Property-Casualty Insurers
REAL,The RealReal Inc. Common Stock,$14.46 ,0.72,5.24%,1313107901,United States,2019,4004592,Consumer Services,Catalog/Specialty Distribution
REC,Emles Real Estate Credit ETF,$24.72 ,0.0371,0.15%,,,2020,4016,,
REDU,RISE Education Cayman Ltd American Depositary Shares,$3.22 ,-0.01,-0.31%,181874957,China,2017,11592,Miscellaneous,Service to the Health Industry
REED,Reeds Inc. Common Stock,$0.92 ,0.01,1.10%,79491055,United States,,932561,Consumer Non-Durables,Beverages (Production/Distribution)
REFR,Research Frontiers Incorporated Common Stock,$2.43 ,0.02,0.83%,76910462,United States,,131449,Capital Goods,Industrial Machinery/Components
REG,Regency Centers Corporation Common Stock,$63.77 ,0.73,1.16%,10832109943,United States,1993,731743,Consumer Services,Real Estate Investment Trusts
REGI,Renewable Energy Group Inc. Common Stock,$63.17 ,5.25,9.06%,3010839620,United States,2012,955927,Basic Industries,Major Chemicals
REGN,Regeneron Pharmaceuticals Inc. Common Stock,$516.62 ,-0.55,-0.11%,55042660539,United States,1991,785572,Health Care,Major Pharmaceuticals
REI,Ring Energy Inc. Common Stock,$2.19 ,0.08,3.79%,217414302,United States,,1392367,Energy,Oil & Gas Production
REKR,Rekor Systems Inc. Common Stock,$9.66 ,0.72,8.05%,396006967,United States,,1766131,Technology,EDP Services
RELI,Reliance Global Group Inc. Common Stock,$3.55 ,0.12,3.50%,14775508,United States,,1374555,Finance,Specialty Insurers
RELIW,Reliance Global Group Inc. Series A Warrants,$0.60 ,0.05,9.09%,0,United States,,2400,Consumer Services,Broadcasting
RELL,Richardson Electronics Ltd. Common Stock,$7.30 ,-0.05,-0.68%,96415874,United States,1983,261112,Technology,Electronic Components
